{
  "schema_version": 1,
  "id": "sample-two-week-python-warm-up",
  "title": "Sample: Two-Week Python Warm-up",
  "source": "import",
  "version": 1,
  "locale": "en",
  "units": [
    {
      "id": "variables-and-types",
      "seq": 1,
      "stage": 1,
      "week": 1,
      "type": "learn",
      "title": "Variables and types",
      "est_minutes": 40,
      "do": "Write ten variables of different types and print their `type()`.",
      "is_checkpoint": false,
      "is_buffer": false,
      "learn": "https://docs.python.org/3/tutorial/introduction.html",
      "tip": "Use the REPL, not a file."
    },
    {
      "id": "lists-and-dictionaries",
      "seq": 2,
      "stage": 1,
      "week": 1,
      "type": "learn",
      "title": "Lists and dictionaries",
      "est_minutes": 45,
      "do": "Build a dict of five countries → capitals; add, delete, iterate.",
      "is_checkpoint": false,
      "is_buffer": false,
      "learn": "Tutorial §5.1 and §5.5"
    },
    {
      "id": "build-a-word-counter",
      "seq": 3,
      "stage": 1,
      "week": 1,
      "type": "build",
      "title": "Build a word counter",
      "est_minutes": 60,
      "do": "Script that reads a text file and prints the 10 most common words.",
      "is_checkpoint": false,
      "is_buffer": false,
      "deliverable": "`wordcount.py` committed."
    },
    {
      "id": "review-week-1",
      "seq": 4,
      "stage": 1,
      "week": 1,
      "type": "review",
      "title": "Review week 1",
      "est_minutes": 30,
      "do": "Re-read your three logs. Rewrite the word counter from memory.",
      "is_checkpoint": false,
      "is_buffer": false
    },
    {
      "id": "buffer",
      "seq": 5,
      "stage": 1,
      "week": 1,
      "type": "rest",
      "title": "Buffer",
      "est_minutes": 15,
      "do": "Rest, or catch up if you are behind.",
      "is_checkpoint": false,
      "is_buffer": true
    },
    {
      "id": "functions-and-scope",
      "seq": 6,
      "stage": 1,
      "week": 2,
      "type": "learn",
      "title": "Functions and scope",
      "est_minutes": 45,
      "do": "Refactor the word counter into three functions.",
      "is_checkpoint": false,
      "is_buffer": false,
      "learn": "Tutorial §4.7"
    },
    {
      "id": "error-handling",
      "seq": 7,
      "stage": 1,
      "week": 2,
      "type": "learn",
      "title": "Error handling",
      "est_minutes": 45,
      "do": "Make the word counter fail gracefully on a missing file.",
      "is_checkpoint": false,
      "is_buffer": false,
      "learn": "Tutorial §8"
    },
    {
      "id": "build-a-cli",
      "seq": 8,
      "stage": 1,
      "week": 2,
      "type": "build",
      "title": "Build a CLI",
      "est_minutes": 60,
      "do": "Add argparse; support `--top N`.",
      "is_checkpoint": false,
      "is_buffer": false,
      "deliverable": "`wordcount.py` with a `--help` that works."
    },
    {
      "id": "stage-1-checkpoint",
      "seq": 9,
      "stage": 1,
      "week": 2,
      "type": "review",
      "title": "Stage 1 checkpoint",
      "est_minutes": 45,
      "do": "From a blank file, write a function that returns the N most common words in a string. No references.",
      "is_checkpoint": true,
      "is_buffer": false
    },
    {
      "id": "buffer-2",
      "seq": 10,
      "stage": 1,
      "week": 2,
      "type": "rest",
      "title": "Buffer",
      "est_minutes": 15,
      "do": "Rest, or catch up if you are behind.",
      "is_checkpoint": false,
      "is_buffer": true
    }
  ]
}
